id;name;url;slug;created_at;updated_at;meta_title;meta_description;meta_keywords
1;Xapo;https://xapo.com/;xapo;2017-12-09 13:51:07;2017-12-09 13:51:07;"Xapo - Bitcoin Wallet &amp; Vault";Xapo is The World’s Secure Bitcoin Wallet. Buy bitcoins, make purchases and send money anywhere around the world with Xapo's convenient, secure bitcoin wallet.;Xapo, Bitcoin, Bitcoin Vault,Bitcoin Wallet
2;FaucetHub.io;https://faucethub.io/;faucethub-io;2017-12-09 13:51:07;2017-12-09 13:51:07;Welcome to FaucetHub.io - Bitcoin Micropayment Service;Easy to use Bitcoin Micropayment service;bitcoin, faucet, micro payments, micro wallet, faucet wallet, faucet game, faucethub
3;FaucetSystem;http://faucetsystem.com/;faucetsystem;2017-12-09 13:51:07;2017-12-09 13:51:07;FaucetSystem.com | Bitcoin microtransactions service;FaucetSystem.com | Bitcoin microtransactions service;FaucetSystem, Faucet System, Bitcoin, Satoshi, Get Free Bitcoins
4;PurseFaucets;https://pursefaucets.com;pursefaucets;2017-12-09 13:51:07;2017-12-09 13:51:07;PurseFaucets;PurseFaucets;PurseFaucets, Bitcoin, Satoshi, Get Free Bitcoins
5;Direct;https://www.blocktrail.com/BTC/address/13vYNWKj3npQTYr7EJVBhcoVkwncEbDUvJ;direct;2017-12-09 13:51:07;2017-12-09 13:51:07;Direct Payment Processor;A faucet which uses this 'payment processor' normally can pay your claims directly to your nominated Bitcoin wallet.;Bitcoin, BlockChain wallet, CoinBase, Online Bitcoin Wallet, Direct Payment Processor
6;CoinPot;https://coinpot.co;coinpot;2017-12-09 13:51:07;2017-12-09 13:51:07;CoinPot | Cryptocurrency microwallet;CoinPot Cryptocurrency microwallet processes Bitcoin, Litecoin, and Dogecoin payments.;CoinPot,Cryptocurrency,microwallet,Bitcoin, Litecoin,Dogecoin,Moon Bitcoin, BitFun
