id,name,url,slug,created_at,updated_at,meta_title,meta_description,meta_keywords
3,Xapo,https://xapo.com/,xapo,"2015-08-18 12:42:21","2017-07-15 12:43:17","Xapo - Bitcoin Wallet &amp; Vault","Xapo is The World’s Secure Bitcoin Wallet. Buy bitcoins, make purchases and send money anywhere around the world with Xapo's convenient, secure bitcoin wallet.","Xapo, Bitcoin, Bitcoin Vault,Bitcoin Wallet"
62,FaucetHub.io,https://faucethub.io/,faucethub-io,"2017-01-07 15:56:44","2017-01-07 15:56:44","Welcome to FaucetHub.io - Bitcoin Micropayment Service","Easy to use Bitcoin Micropayment service","bitcoin, faucet, micro payments, micro wallet, faucet wallet, faucet game, faucethub"
64,FaucetSystem,http://faucetsystem.com/,faucetsystem,"2017-01-16 20:18:10","2017-01-16 20:18:10","FaucetSystem.com | Bitcoin microtransactions service","FaucetSystem.com | Bitcoin microtransactions service","FaucetSystem, Faucet System, Bitcoin, Satoshi, Get Free Bitcoins"
65,PurseFaucets,https://pursefaucets.com,pursefaucets,"2017-01-16 20:20:19","2017-01-16 20:20:19",PurseFaucets,PurseFaucets,"PurseFaucets, Bitcoin, Satoshi, Get Free Bitcoins"
73,Direct,https://www.blocktrail.com/BTC/address/13vYNWKj3npQTYr7EJVBhcoVkwncEbDUvJ,direct,"2017-03-16 20:42:54","2017-03-16 20:42:54","Direct Payment Processor","A faucet which uses this 'payment processor' normally can pay your claims directly to your nominated Bitcoin wallet.","Bitcoin, BlockChain wallet, CoinBase, Online Bitcoin Wallet, Direct Payment Processor"
74,CoinPot,https://coinpot.co,coinpot,"2017-07-06 22:11:19","2017-07-06 22:11:19","CoinPot | Cryptocurrency microwallet","CoinPot Cryptocurrency microwallet processes Bitcoin, Litecoin, and Dogecoin payments.","CoinPot,Cryptocurrency,microwallet,Bitcoin, Litecoin,Dogecoin,Moon Bitcoin, BitFun"
